{
  "description": "MutatingWebhook describes an admission webhook and the resources and operations it applies to.",
  "properties": {
    "admissionReviewVersions": {
      "description": "AdmissionReviewVersions is an ordered list of preferred `AdmissionReview` versions the Webhook expects. API server will try to use first version in the list which it supports. If none of the versions specified in this list supported by API server, validation will fail for this object. If a persisted webhook configuration specifies allowed versions and does not include any versions known to the API Server, calls to the webhook will fail and be subject to the failure policy.",
      "items": {
        "type": [
          "string",
          "null"
        ]
      },
      "type": [
        "array",
        "null"
      ],
      "x-kubernetes-list-type": "atomic"
    },
    "clientConfig": {
      "$ref": "https://raw.githubusercontent.com/yannh/kubernetes-json-schema/master/v1.33.13/_definitions.json#/definitions/io.k8s.api.admissionregistration.v1.WebhookClientConfig",
      "description": "ClientConfig defines how to communicate with the hook. Required"
    },
    "failurePolicy": {
      "description": "FailurePolicy defines how unrecognized errors from the admission endpoint are handled - allowed values are Ignore or Fail. Defaults to Fail.",
      "type": [
        "string",
        "null"
      ]
    },
    "matchConditions": {
      "description": "MatchConditions is a list of conditions that must be met for a request to be sent to this webhook. Match conditions filter requests that have already been matched by the rules, namespaceSelector, and objectSelector. An empty list of matchConditions matches all requests. There are a maximum of 64 match conditions allowed.\n\nThe exact matching logic is (in order):\n  1. If ANY matchCondition evaluates to FALSE, the webhook is skipped.\n  2. If ALL matchConditions evaluate to TRUE, the webhook is called.\n  3. If any matchCondition evaluates to an error (but none are FALSE):\n     - If failurePolicy=Fail, reject the request\n     - If failurePolicy=Ignore, the error is ignored and the webhook is skipped",
      "items": {
        "$ref": "https://raw.githubusercontent.com/yannh/kubernetes-json-schema/master/v1.33.13/_definitions.json#/definitions/io.k8s.api.admissionregistration.v1.MatchCondition"
      },
      "type": [
        "array",
        "null"
      ],
      "x-kubernetes-list-map-keys": [
        "name"
      ],
      "x-kubernetes-list-type": "map",
      "x-kubernetes-patch-merge-key": "name",
      "x-kubernetes-patch-strategy": "merge"
    },
    "matchPolicy": {
      "description": "matchPolicy defines how the \"rules\" list is used to match incoming requests. Allowed values are \"Exact\" or \"Equivalent\".\n\n- Exact: match a request only if it exactly matches a specified rule. For example, if deployments can be modified via apps/v1, apps/v1beta1, and extensions/v1beta1, but \"rules\" only included `apiGroups:[\"apps\"], apiVersions:[\"v1\"], resources: [\"deployments\"]`, a request to apps/v1beta1 or extensions/v1beta1 would not be sent to the webhook.\n\n- Equivalent: match a request if modifies a resource listed in rules, even via another API group or version. For example, if deployments can be modified via apps/v1, apps/v1beta1, and extensions/v1beta1, and \"rules\" only included `apiGroups:[\"apps\"], apiVersions:[\"v1\"], resources: [\"deployments\"]`, a request to apps/v1beta1 or extensions/v1beta1 would be converted to apps/v1 and sent to the webhook.\n\nDefaults to \"Equivalent\"",
      "type": [
        "string",
        "null"
      ]
    },
    "name": {
      "description": "The name of the admission webhook. Name should be fully qualified, e.g., imagepolicy.kubernetes.io, where \"imagepolicy\" is the name of the webhook, and kubernetes.io is the name of the organization. Required.",
      "type": [
        "string",
        "null"
      ]
    },
    "namespaceSelector": {
      "$ref": "https://raw.githubusercontent.com/yannh/kubernetes-json-schema/master/v1.33.13/_definitions.json#/definitions/io.k8s.apimachinery.pkg.apis.meta.v1.LabelSelector",
      "description": "NamespaceSelector decides whether to run the webhook on an object based on whether the namespace for that object matches the selector. If the object itself is a namespace, the matching is performed on object.metadata.labels. If the object is another cluster scoped resource, it never skips the webhook.\n\nFor example, to run the webhook on any objects whose namespace is not associated with \"runlevel\" of \"0\" or \"1\";  you will set the selector as follows: \"namespaceSelector\": {\n  \"matchExpressions\": [\n    {\n      \"key\": \"runlevel\",\n      \"operator\": \"NotIn\",\n      \"values\": [\n        \"0\",\n        \"1\"\n      ]\n    }\n  ]\n}\n\nIf instead you want to only run the webhook on any objects whose namespace is associated with the \"environment\" of \"prod\" or \"staging\"; you will set the selector as follows: \"namespaceSelector\": {\n  \"matchExpressions\": [\n    {\n      \"key\": \"environment\",\n      \"operator\": \"In\",\n      \"values\": [\n        \"prod\",\n        \"staging\"\n      ]\n    }\n  ]\n}\n\nSee https://kubernetes.io/docs/concepts/overview/working-with-objects/labels/ for more examples of label selectors.\n\nDefault to the empty LabelSelector, which matches everything."
    },
    "objectSelector": {
      "$ref": "https://raw.githubusercontent.com/yannh/kubernetes-json-schema/master/v1.33.13/_definitions.json#/definitions/io.k8s.apimachinery.pkg.apis.meta.v1.LabelSelector",
      "description": "ObjectSelector decides whether to run the webhook based on if the object has matching labels. objectSelector is evaluated against both the oldObject and newObject that would be sent to the webhook, and is considered to match if either object matches the selector. A null object (oldObject in the case of create, or newObject in the case of delete) or an object that cannot have labels (like a DeploymentRollback or a PodProxyOptions object) is not considered to match. Use the object selector only if the webhook is opt-in, because end users may skip the admission webhook by setting the labels. Default to the empty LabelSelector, which matches everything."
    },
    "reinvocationPolicy": {
      "description": "reinvocationPolicy indicates whether this webhook should be called multiple times as part of a single admission evaluation. Allowed values are \"Never\" and \"IfNeeded\".\n\nNever: the webhook will not be called more than once in a single admission evaluation.\n\nIfNeeded: the webhook will be called at least one additional time as part of the admission evaluation if the object being admitted is modified by other admission plugins after the initial webhook call. Webhooks that specify this option *must* be idempotent, able to process objects they previously admitted. Note: * the number of additional invocations is not guaranteed to be exactly one. * if additional invocations result in further modifications to the object, webhooks are not guaranteed to be invoked again. * webhooks that use this option may be reordered to minimize the number of additional invocations. * to validate an object after all mutations are guaranteed complete, use a validating admission webhook instead.\n\nDefaults to \"Never\".",
      "type": [
        "string",
        "null"
      ]
    },
    "rules": {
      "description": "Rules describes what operations on what resources/subresources the webhook cares about. The webhook cares about an operation if it matches _any_ Rule. However, in order to prevent ValidatingAdmissionWebhooks and MutatingAdmissionWebhooks from putting the cluster in a state which cannot be recovered from without completely disabling the plugin, ValidatingAdmissionWebhooks and MutatingAdmissionWebhooks are never called on admission requests for ValidatingWebhookConfiguration and MutatingWebhookConfiguration objects.",
      "items": {
        "$ref": "https://raw.githubusercontent.com/yannh/kubernetes-json-schema/master/v1.33.13/_definitions.json#/definitions/io.k8s.api.admissionregistration.v1.RuleWithOperations"
      },
      "type": [
        "array",
        "null"
      ],
      "x-kubernetes-list-type": "atomic"
    },
    "sideEffects": {
      "description": "SideEffects states whether this webhook has side effects. Acceptable values are: None, NoneOnDryRun (webhooks created via v1beta1 may also specify Some or Unknown). Webhooks with side effects MUST implement a reconciliation system, since a request may be rejected by a future step in the admission chain and the side effects therefore need to be undone. Requests with the dryRun attribute will be auto-rejected if they match a webhook with sideEffects == Unknown or Some.",
      "type": [
        "string",
        "null"
      ]
    },
    "timeoutSeconds": {
      "description": "TimeoutSeconds specifies the timeout for this webhook. After the timeout passes, the webhook call will be ignored or the API call will fail based on the failure policy. The timeout value must be between 1 and 30 seconds. Default to 10 seconds.",
      "format": "int32",
      "type": [
        "integer",
        "null"
      ]
    }
  },
  "required": [
    "name",
    "clientConfig",
    "sideEffects",
    "admissionReviewVersions"
  ],
  "type": "object",
  "$schema": "http://json-schema.org/schema#"
}