{
  "description": "PodGroupSpec defines the desired state of a PodGroup.",
  "properties": {
    "disruptionMode": {
      "$ref": "_definitions.json#/definitions/io.k8s.api.scheduling.v1alpha3.DisruptionMode",
      "description": "DisruptionMode defines the mode in which a given PodGroup can be disrupted. Controllers are expected to fill this field by copying it from a PodGroupTemplate. One of Single, All. Defaults to Single if unset. This field is immutable."
    },
    "podGroupTemplateRef": {
      "$ref": "_definitions.json#/definitions/io.k8s.api.scheduling.v1alpha3.PodGroupTemplateReference",
      "description": "PodGroupTemplateRef references an optional PodGroup template within other object (e.g. Workload) that was used to create the PodGroup. This field is immutable."
    },
    "priority": {
      "description": "Priority is the value of priority of this pod group. Various system components use this field to find the priority of the pod group. When Priority Admission Controller is enabled, it prevents users from setting this field. The admission controller populates this field from PriorityClassName. The higher the value, the higher the priority. This field is immutable.",
      "format": "int32",
      "type": [
        "integer",
        "null"
      ]
    },
    "priorityClassName": {
      "description": "PriorityClassName defines the priority that should be considered when scheduling this pod group. Controllers are expected to fill this field by copying it from a PodGroupTemplate. Otherwise, it is validated and resolved similarly to the PriorityClassName on PodGroupTemplate (i.e. if no priority class is specified, admission control can set this to the global default priority class if it exists. Otherwise, the pod group's priority will be zero). This field is immutable.",
      "type": [
        "string",
        "null"
      ]
    },
    "resourceClaims": {
      "description": "ResourceClaims defines which ResourceClaims may be shared among Pods in the group. Pods consume the devices allocated to a PodGroup's claim by defining a claim in its own Spec.ResourceClaims that matches the PodGroup's claim exactly. The claim must have the same name and refer to the same ResourceClaim or ResourceClaimTemplate.\n\nThis is an alpha-level field and requires that the DRAWorkloadResourceClaims feature gate is enabled.\n\nThis field is immutable.",
      "items": {
        "$ref": "_definitions.json#/definitions/io.k8s.api.scheduling.v1alpha3.PodGroupResourceClaim"
      },
      "type": [
        "array",
        "null"
      ],
      "x-kubernetes-list-map-keys": [
        "name"
      ],
      "x-kubernetes-list-type": "map",
      "x-kubernetes-patch-merge-key": "name",
      "x-kubernetes-patch-strategy": "merge,retainKeys"
    },
    "schedulingConstraints": {
      "$ref": "_definitions.json#/definitions/io.k8s.api.scheduling.v1alpha3.PodGroupSchedulingConstraints",
      "description": "SchedulingConstraints defines optional scheduling constraints (e.g. topology) for this PodGroup. Controllers are expected to fill this field by copying it from a PodGroupTemplate. This field is immutable. This field is only available when the TopologyAwareWorkloadScheduling feature gate is enabled."
    },
    "schedulingPolicy": {
      "$ref": "_definitions.json#/definitions/io.k8s.api.scheduling.v1alpha3.PodGroupSchedulingPolicy",
      "description": "SchedulingPolicy defines the scheduling policy for this instance of the PodGroup. Controllers are expected to fill this field by copying it from a PodGroupTemplate. This field is immutable."
    }
  },
  "required": [
    "schedulingPolicy"
  ],
  "type": "object",
  "$schema": "http://json-schema.org/schema#"
}